{
  "deck": {
    "main": [
      85138716,
      69247929,
      69247929,
      2964201,
      2964201,
      2964201,
      2971090,
      2971090,
      2971090,
      3797883,
      3797883,
      3797883,
      4035199,
      4035199,
      4035199,
      4179849,
      4179849,
      4179849,
      4392470,
      4392470,
      4392470,
      6368038,
      6368038,
      6368038,
      6631034,
      6631034,
      6631034,
      6740720,
      6740720,
      6740720,
      7562372,
      7562372,
      7562372,
      8353769,
      8353769,
      8353769,
      9540040,
      9540040,
      9540040,
      10538007
    ],
    "extra": [
      84013237,
      71594310,
      77637979
    ],
    "side": []
  },
  "opening_hand": [
    85138716,
    2964201,
    2964201,
    2964201,
    2971090
  ],
  "seed": 1,
  "rules": "ocg-mr5",
  "banlist_id": "latest-ocg",
  "as_of": "2026-10-07",
  "search": {
    "top_k": 5,
    "node_budget": 10000,
    "beam_width": 32,
    "max_depth": 64,
    "time_limit_ms": 60000
  }
}